{
  "schema_version": "paper2-designed-source-candidate-ledger-v1",
  "geometry_version": "paper2-designed-corpus-geometry-v1",
  "basis_version": "paper2-working-basis-v1",
  "phi_version": "paper2-phi-comparison-v1",
  "state": "CANDIDATE_LEDGER_FROZEN",
  "selection_outcome_blind": true,
  "claim_ir_consumed": false,
  "structural_signature_consumed": false,
  "phi_consumed": false,
  "records": [
    {
      "slot_id": "MEM01",
      "surface": "primary",
      "sampling_stratum": "Memory",
      "challenge_pressure": null,
      "candidate_rank": 1,
      "candidate_state": "CANDIDATE",
      "stable_identity": {
        "kind": "DOI",
        "value": "10.1037/0033-295X.99.2.195"
      },
      "title": "Memory and the hippocampus",
      "year": 1992,
      "source_type": "journal_article",
      "canonical_locator": "https://doi.org/10.1037/0033-295X.99.2.195",
      "source_access_class": "ABSTRACT_ONLY",
      "read_status": "ABSTRACT_ONLY_READ",
      "candidate_rationale": "Source inspection supports the pre-mapping coverage surface [partition_subsystem, temporal_persistence, dissociation] for frozen slot MEM01; rank was fixed from slot fit, source accessibility, and diversity before downstream mapping.",
      "coverage_tags": [
        "partition_subsystem",
        "temporal_persistence",
        "dissociation"
      ],
      "author_lineage_key": "squire",
      "registry_reference": "#23:5848069352"
    },
    {
      "slot_id": "MEM01",
      "surface": "primary",
      "sampling_stratum": "Memory",
      "challenge_pressure": null,
      "candidate_rank": 2,
      "candidate_state": "CANDIDATE",
      "stable_identity": {
        "kind": "DOI",
        "value": "10.1126/science.7414331"
      },
      "title": "Preserved learning and retention of pattern-analyzing skill in amnesia",
      "year": 1980,
      "source_type": "journal_article",
      "canonical_locator": "https://doi.org/10.1126/science.7414331",
      "source_access_class": "ABSTRACT_ONLY",
      "read_status": "ABSTRACT_ONLY_READ",
      "candidate_rationale": "Source inspection supports the pre-mapping coverage surface [partition_subsystem, temporal_persistence, dissociation] for frozen slot MEM01; rank was fixed from slot fit, source accessibility, and diversity before downstream mapping.",
      "coverage_tags": [
        "partition_subsystem",
        "temporal_persistence",
        "dissociation"
      ],
      "author_lineage_key": "cohen",
      "registry_reference": "#23:5848069352"
    },
    {
      "slot_id": "MEM01",
      "surface": "primary",
      "sampling_stratum": "Memory",
      "challenge_pressure": null,
      "candidate_rank": 3,
      "candidate_state": "CANDIDATE",
      "stable_identity": {
        "kind": "DOI",
        "value": "10.1037/0278-7393.13.3.501"
      },
      "title": "Implicit memory: History and current status",
      "year": 1987,
      "source_type": "journal_article",
      "canonical_locator": "https://doi.org/10.1037/0278-7393.13.3.501",
      "source_access_class": "ABSTRACT_ONLY",
      "read_status": "ABSTRACT_ONLY_READ",
      "candidate_rationale": "Source inspection supports the pre-mapping coverage surface [partition_subsystem, temporal_persistence, dissociation] for frozen slot MEM01; rank was fixed from slot fit, source accessibility, and diversity before downstream mapping.",
      "coverage_tags": [
        "partition_subsystem",
        "temporal_persistence",
        "dissociation"
      ],
      "author_lineage_key": "schacter",
      "registry_reference": "#23:5848069352"
    },
    {
      "slot_id": "MEM02",
      "surface": "primary",
      "sampling_stratum": "Memory",
      "challenge_pressure": null,
      "candidate_rank": 1,
      "candidate_state": "CANDIDATE",
      "stable_identity": {
        "kind": "DOI",
        "value": "10.1017/S0140525X01003922"
      },
      "title": "The magical number 4 in short-term memory",
      "year": 2001,
      "source_type": "journal_article",
      "canonical_locator": "https://doi.org/10.1017/S0140525X01003922",
      "source_access_class": "ABSTRACT_ONLY",
      "read_status": "ABSTRACT_ONLY_READ",
      "candidate_rationale": "Source inspection supports the pre-mapping coverage surface [resource_capacity, criterion, probe] for frozen slot MEM02; rank was fixed from slot fit, source accessibility, and diversity before downstream mapping.",
      "coverage_tags": [
        "resource_capacity",
        "criterion",
        "probe"
      ],
      "author_lineage_key": "cowan",
      "registry_reference": "#23:5848069602"
    },
    {
      "slot_id": "MEM02",
      "surface": "primary",
      "sampling_stratum": "Memory",
      "challenge_pressure": null,
      "candidate_rank": 2,
      "candidate_state": "CANDIDATE",
      "stable_identity": {
        "kind": "DOI",
        "value": "10.1016/j.tics.2013.06.006"
      },
      "title": "Visual working memory capacity",
      "year": 2013,
      "source_type": "journal_article",
      "canonical_locator": "https://doi.org/10.1016/j.tics.2013.06.006",
      "source_access_class": "ABSTRACT_ONLY",
      "read_status": "ABSTRACT_ONLY_READ",
      "candidate_rationale": "Source inspection supports the pre-mapping coverage surface [resource_capacity, criterion, probe] for frozen slot MEM02; rank was fixed from slot fit, source accessibility, and diversity before downstream mapping.",
      "coverage_tags": [
        "resource_capacity",
        "criterion",
        "probe"
      ],
      "author_lineage_key": "luck",
      "registry_reference": "#23:5848069602"
    },
    {
      "slot_id": "MEM02",
      "surface": "primary",
      "sampling_stratum": "Memory",
      "challenge_pressure": null,
      "candidate_rank": 3,
      "candidate_state": "CANDIDATE",
      "stable_identity": {
        "kind": "DOI",
        "value": "10.1038/nn.3655"
      },
      "title": "Changing concepts of working memory",
      "year": 2014,
      "source_type": "journal_article",
      "canonical_locator": "https://doi.org/10.1038/nn.3655",
      "source_access_class": "ABSTRACT_ONLY",
      "read_status": "ABSTRACT_ONLY_READ",
      "candidate_rationale": "Source inspection supports the pre-mapping coverage surface [resource_capacity, criterion, probe] for frozen slot MEM02; rank was fixed from slot fit, source accessibility, and diversity before downstream mapping.",
      "coverage_tags": [
        "resource_capacity",
        "criterion",
        "probe"
      ],
      "author_lineage_key": "ma",
      "registry_reference": "#23:5848069602"
    },
    {
      "slot_id": "MEM03",
      "surface": "primary",
      "sampling_stratum": "Memory",
      "challenge_pressure": null,
      "candidate_rank": 1,
      "candidate_state": "CANDIDATE",
      "stable_identity": {
        "kind": "DOI",
        "value": "10.1111/j.1467-9280.2006.01693.x"
      },
      "title": "Test-Enhanced Learning",
      "year": 2006,
      "source_type": "journal_article",
      "canonical_locator": "https://doi.org/10.1111/j.1467-9280.2006.01693.x",
      "source_access_class": "ABSTRACT_ONLY",
      "read_status": "ABSTRACT_ONLY_READ",
      "candidate_rationale": "Source inspection supports the pre-mapping coverage surface [temporal_persistence, intervention, acquisition_update] for frozen slot MEM03; rank was fixed from slot fit, source accessibility, and diversity before downstream mapping.",
      "coverage_tags": [
        "temporal_persistence",
        "intervention",
        "acquisition_update"
      ],
      "author_lineage_key": "roediger",
      "registry_reference": "#23:5848069805"
    },
    {
      "slot_id": "MEM03",
      "surface": "primary",
      "sampling_stratum": "Memory",
      "challenge_pressure": null,
      "candidate_rank": 2,
      "candidate_state": "CANDIDATE",
      "stable_identity": {
        "kind": "DOI",
        "value": "10.1126/science.1152408"
      },
      "title": "The Critical Importance of Retrieval for Learning",
      "year": 2008,
      "source_type": "journal_article",
      "canonical_locator": "https://doi.org/10.1126/science.1152408",
      "source_access_class": "ABSTRACT_ONLY",
      "read_status": "ABSTRACT_ONLY_READ",
      "candidate_rationale": "Source inspection supports the pre-mapping coverage surface [temporal_persistence, intervention, acquisition_update] for frozen slot MEM03; rank was fixed from slot fit, source accessibility, and diversity before downstream mapping.",
      "coverage_tags": [
        "temporal_persistence",
        "intervention",
        "acquisition_update"
      ],
      "author_lineage_key": "karpicke",
      "registry_reference": "#23:5848069805"
    },
    {
      "slot_id": "MEM03",
      "surface": "primary",
      "sampling_stratum": "Memory",
      "challenge_pressure": null,
      "candidate_rank": 3,
      "candidate_state": "CANDIDATE",
      "stable_identity": {
        "kind": "DOI",
        "value": "10.1037/a0037559"
      },
      "title": "The effect of testing versus restudy on retention",
      "year": 2014,
      "source_type": "journal_article",
      "canonical_locator": "https://doi.org/10.1037/a0037559",
      "source_access_class": "ABSTRACT_ONLY",
      "read_status": "ABSTRACT_ONLY_READ",
      "candidate_rationale": "Source inspection supports the pre-mapping coverage surface [temporal_persistence, intervention, acquisition_update] for frozen slot MEM03; rank was fixed from slot fit, source accessibility, and diversity before downstream mapping.",
      "coverage_tags": [
        "temporal_persistence",
        "intervention",
        "acquisition_update"
      ],
      "author_lineage_key": "rowland",
      "registry_reference": "#23:5848069805"
    },
    {
      "slot_id": "MEM04",
      "surface": "primary",
      "sampling_stratum": "Memory",
      "challenge_pressure": null,
      "candidate_rank": 1,
      "candidate_state": "CANDIDATE",
      "stable_identity": {
        "kind": "DOI",